{
  "schema_id": "gait.scout.operational_event",
  "schema_version": "1.0.0",
  "created_at": "2026-02-06T00:00:00Z",
  "producer_version": "0.0.0-dev",
  "correlation_id": "01HNEXAMPLE123",
  "command": "verify",
  "phase": "end",
  "exit_code": 0,
  "error_category": "none",
  "retryable": false,
  "elapsed_ms": 12,
  "environment": {
    "os": "linux",
    "arch": "amd64"
  }
}
